id,title,ingredients,directions,link,source,ner
551171,Warm Potato Salad,"{2 c. cubed red potatoes,2 Tbsp. finely chopped purple onion,1 Tbsp. plus 1 tsp. white wine vinegar,1 Tbsp. freeze-dried chives,1 tsp. olive oil,1/4 tsp. sugar,1/4 tsp. salt,1/4 tsp. pepper}","{Place potatoes in a saucepan. Add water to cover.,Bring to a boil.,""Cover, reduce heat and simmer 10 minutes or until the potatoes are tender."",Drain.,Place potatoes and onion in a bowl. Combine vinegar and remaining ingredients.,Stir well. Add to the potato mixture; toss gently to coat.,Yields 4 servings (about 69 calories per 1/2 cup serving).}",www.cookbooks.com/Recipe-Details.aspx?id=699285,Gathered,"{potatoes,purple onion,white wine vinegar,chives,olive oil,sugar,salt,pepper}"
551172,Rotini Salad,"{12 oz. pkg. rotini,6 oz. pkg. Good Seasons Zesty Italian salad mix,16 oz. Kraft Zesty Italian dressing,""2 cucumbers, diced"",""2 tomatoes, diced"",""1 bell pepper, diced"",""1 medium size purple onion, diced"",""black olives, optional""}",{Cook rotini according to pkg. directions. Mix all ingredients together with rotini and refrigerate.},www.cookbooks.com/Recipe-Details.aspx?id=4586,Gathered,"{rotini,Italian salad mix,Italian dressing,cucumbers,tomatoes,bell pepper,purple onion,black olives}"
551173,African Yam Fritters,"{1 1/2 lb. yams,1 egg,1 chopped onion,1 chopped tomato,""1 small green chile, minced"",1/2 c. bread crumbs,peanut oil,pinch of cayenne pepper,salt and pepper}","{""Boil, peel and mash yams."",Beat egg.,""Saute tomato, chile and onion in peanut oil until onion is transparent and soft."",""Combine sauteed mixture, egg, bread crumbs, seasonings and yams."",Form mixture into patties and brown on both sides.,Eat!,Makes 10 small servings.}",www.cookbooks.com/Recipe-Details.aspx?id=432602,Gathered,"{yams,egg,onion,tomato,green chile,bread crumbs,peanut oil,cayenne pepper,salt}"
551174,Savory Pork Chops,"{pork chops,apples,brown sugar,cinnamon,""flour, salt and pepper""}","{Select chops 3/4-inch thick.,Salt and dredge with flour; fry in small amount of oil until brown on both sides.}",www.cookbooks.com/Recipe-Details.aspx?id=238899,Gathered,"{pork chops,apples,brown sugar,cinnamon,flour}"
551175,Szechuan Sesame Noodles,"{1 lb. linguini,2 Tbsp. oil,3 Tbsp. peanut butter,2 tsp. chili powder,2 tsp. Tabasco sauce,1 1/2 Tbsp. garlic,3 Tbsp. soy sauce,1 Tbsp. oil,2 tsp. fresh ginger,1 tsp. salt,2 tsp. sugar,3 Tbsp. sesame seed}","{Cook 1 pound of linguini in water with 1 tablespoon oil to prevent sticking.,""Drain, rinse and add 1 tablespoon oil to toss.""}",www.cookbooks.com/Recipe-Details.aspx?id=557662,Gathered,"{linguini,oil,peanut butter,chili powder,Tabasco sauce,garlic,soy sauce,oil,fresh ginger,salt,sugar,sesame seed}"
